{
  "taskRunID": "task-1",
  "requesterPersonID": "person-1",
  "originConversationID": "conversation-1",
  "originReplyTargetID": "message-1",
  "originIsThread": true,
  "currentAttemptID": "attempt-1",
  "currentAgentProfileName": "default",
  "status": "running",
  "prompt": "Prepare the weekly report",
  "result": "",
  "failureReason": "",
  "createdAt": "2026-07-14T00:00:00Z",
  "updatedAt": "2026-07-14T00:01:00Z"
}
